150,Betriax,https://www.crunchbase.com/organization/betriax,"Financial Exchanges, Financial Services, FinTech, Marketplace, Peer to Peer","Bogotá, Distrito Especial, Colombia",Peer-to-peer Spot Foreign Exchange Marketplace for SME companies in Latin America. We believe in transparency and efficiency.,"94,451",Latin America,Active,14/08/2018,day,3.0,Betriax serves SME through a transparent foreign exchange marketplace where companies fix the exchange rate between them. Our 100% banked model let companies to exchange their US Dollars and local currencies at the most convenient rates. Powered by The Founder Institute.,"Commerce and Shopping, Financial Services, Lending and Investments, Other",1.0,Roberto Vargas,1,Seed,31/07/2019,40000,USD,40000,Pre-Seed,40000.0,USD,40000.0,Pre-Seed,40000.0,USD,40000.0,40000,USD,40000,Start-Up Chile,0.0,1.0,0.0,"98,501",19.0,0.0,Colombia,Bogotá,Distrito Especial,0,0.0,0.0,1000.0,2000.0,1.0,1.0,1.0,1.0,1.0,1.0,1.0,0.0
151,Agros,https://www.crunchbase.com/organization/agros,"Agriculture, Database, Software","Perú, Valle del Cauca, Colombia",Agros is specialize in AgroInteligencia that provides solutions for Online Monitoring and Data Analysis of the production,"94,598",Latin America,Active,01/01/2013,year,0.0,"We are a company specialized in AgroInteligencia that provides solutions for Online Monitoring and Data Analysis of the production, industrial and logistics processes of the agri-food sector.","Agriculture and Farming, Data and Analytics, Software",0.0,,1,,22/11/2019,250000,USD,250000,Grant,0.0,,0.0,,0.0,,0.0,250000,USD,250000,MIT Inclusive Innovation Challenge,1.0,1.0,0.0,"98,655",10.0,0.0,Colombia,Perú,Valle del Cauca,0,0.0,1000000.0,101.0,250.0,1.0,1.0,1.0,0.0,1.0,0.0,1.0,1.0
152,Sarta,https://www.crunchbase.com/organization/sarta-2,"Fashion, Lifestyle, Shopping","Bogotá, Distrito Especial, Colombia",Contact us for our exclusive showroom go and rent the dress you choose.,"95,844",Latin America,Active,01/07/2012,day,0.0,"In Sarta Dresses understand what it means for us to have a party. For this we create the best opción.Compra in Sarta the perfect dress smartly; enjoy it and we sell it. New and nearly new dresses from big brands like Nicole Miller, BCBG, Talbot Tunhof including discount between 10 and 70%.","Clothing and Apparel, Commerce and Shopping, Community and Lifestyle, Design",0.0,,2,Seed,01/06/2014,300000000,COP,158005,Convertible Note,91000000.0,COP,47279.0,Seed,91000000.0,COP,47279.0,391000000,COP,205284,Wayra,1.0,1.0,0.0,"99,958",0.0,0.0,Colombia,Bogotá,Distrito Especial,0,0.0,1000000.0,1000.0,2000.0,1.0,1.0,1.0,0.0,1.0,1.0,1.0,1.0
153,Loopa,https://www.crunchbase.com/organization/loopa,"E-Learning, EdTech, Education, Edutainment, Internet, Robotics, Software, Training","Cali, Valle del Cauca, Colombia",Learn programming through interactive courses.,"96,267",Latin America,Active,01/01/2016,month,0.0,"Loopa is an e-learning platform based in Colombia that teaches the latest and most demanded technologies for web and mobile development through interactive courses and coding challenges, 100% in Spanish. Courses are organized into learning careers and provide to their students the knowledge, concepts and enough experience to become profesional developers. Additionally, in order to increase the completion rate, their platform has a much more human approach to the teaching process, due to the fact that it promotes the interaction among students and mentors of a course in real time through chats and online live classes.  Their goals are: • Democratize and universalize education in Latin America, encouraging people to learn what they need to become professional developers in their mother tongue. • Contribute to reduce the deficit of qualified developers in the region, which in average is superior to 62%. • Make more accessible software development technologies to ethnically marginalized communities, in order to provide them the right tools to improve their quality of life. ￼","Education, Hardware, Internet Services, Media and Entertainment, Science and Engineering, Software",0.0,,1,Seed,01/06/2016,20000,USD,20000,Seed,20000.0,USD,20000.0,Seed,20000.0,USD,20000.0,20000,USD,20000,,0.0,0.0,1.0,"100,415",27.0,7.0,Colombia,Cali,Valle del Cauca,0,0.0,0.0,1000.0,2000.0,1.0,1.0,1.0,1.0,1.0,0.0,1.0,1.0
154,Omni,https://www.crunchbase.com/organization/omni-64ae,"Automotive, Freight Service, Logistics, Transportation","Bogotá, Distrito Especial, Colombia",Transport services in Colombia.,"96,984",Latin America,Active,07/06/2012,day,0.0,,Transportation,0.0,,2,Seed,05/03/2018,25000,USD,25000,Seed,25000.0,USD,25000.0,Seed,50000.0,USD,50000.0,50000,USD,50000,Tegel Ventures,1.0,1.0,0.0,"101,174",16.0,0.0,Colombia,Bogotá,Distrito Especial,0,0.0,0.0,1000.0,2000.0,1.0,1.0,1.0,0.0,0.0,0.0,1.0,0.0
155,Izzy Money,https://www.crunchbase.com/organization/izzy-money,"Finance, Mobile, Mobile Apps","Bogotá, Distrito Especial, Colombia",Izzy Money provides a mobile platform for managing money and cost control.,"97,116",Latin America,Closed,01/01/2012,year,0.0,,"Apps, Financial Services, Mobile, Software",0.0,,1,Seed,01/09/2013,91000000,COP,46913,Seed,91000000.0,COP,46913.0,Seed,91000000.0,COP,46913.0,91000000,COP,46913,Wayra,1.0,1.0,0.0,"101,314",1.0,0.0,Colombia,Bogotá,Distrito Especial,0,0.0,0.0,0.0,0.0,1.0,1.0,1.0,1.0,1.0,0.0,0.0,0.0
156,Appflow,https://www.crunchbase.com/organization/appflow,"Business Development, Information Services, Information Technology, SaaS, Software, Web Design","Bogotá, Distrito Especial, Colombia","Appflow allows companies to automate business processes, no coding required.","98,362",Latin America,Active,01/02/2014,day,1.0,"AppFlow is a powerful web platform that allows companies to automate business processes they currently manage with excel forms and email, no coding required. ","Design, Information Technology, Professional Services, Software",1.0,Javier Martinez Sintes,1,,01/02/2017,100000,USD,100000,Convertible Note,0.0,,0.0,,0.0,,0.0,100000,USD,100000,Right Side Capital Management,0.0,1.0,0.0,"102,641",11.0,14.0,Colombia,Bogotá,Distrito Especial,0,0.0,1000000.0,1000.0,2000.0,1.0,1.0,1.0,0.0,0.0,1.0,0.0,0.0
157,Ekkofy,https://www.crunchbase.com/organization/ekkofy,"Advertising, Marketing, Marketing Automation, Mobile Apps, Software","Bogotá, Distrito Especial, Colombia",Referral Ekkosystem - WOM an referral Social Platform.,"98,447",Latin America,Active,03/10/2019,day,0.0,Ekkofy - Referral Ekkosystem - Word of mouth and referral social platform.,"Advertising, Apps, Mobile, Sales and Marketing, Software",1.0,Daniel Palis,1,Seed,15/02/2020,150000,USD,150000,Pre-Seed,150000.0,USD,150000.0,Pre-Seed,150000.0,USD,150000.0,150000,USD,150000,,0.0,0.0,0.0,"102,731",27.0,0.0,Colombia,Bogotá,Distrito Especial,0,0.0,0.0,1000.0,2000.0,1.0,1.0,1.0,0.0,0.0,1.0,0.0,1.0
158,Vosavos,https://www.crunchbase.com/organization/vosavos,"Child Care, Recruiting","Bogotá, Distrito Especial, Colombia",Vosavos is an online platform that enables individuals to recruit certified house cleaners.,"98,796",Latin America,Active,01/01/2013,year,0.0,"Vosavos is an online platform that enables individuals to recruit certified house cleaners, and childcare and adult care professionals. Clients can go through background-checked professionals whose profiles contain work experience, references, and legal histories. Using multi-criteria algorithm, individuals can select professionals best-suited to each of their needs. Vosavos  Now HOGARU. was launched in 2013 and is based in Bogota, Columbia.","Health Care, Professional Services",3.0,"Gonzalo Rodriguez, Matteo Cera, Oscar Peña",2,Seed,01/04/2015,750000000,COP,291259,Seed,750000000.0,COP,291259.0,Seed,750000000.0,COP,291259.0,932000000,COP,372750,Wayra,1.0,1.0,0.0,"103,096",4.0,0.0,Colombia,Bogotá,Distrito Especial,0,10000000.0,50000000.0,1000.0,2000.0,1.0,1.0,1.0,1.0,1.0,1.0,1.0,1.0
159,Mis Finanzas Personales,https://www.crunchbase.com/organization/mis-finanzas-personales,"FinTech, Personal Finance","Bogotá, Distrito Especial, Colombia",PFM - Fintech,"99,483",Latin America,Active,22/01/2020,day,0.0,MisFinanzasPersonales.Co is a digital financial advisor. We help millenials and centenials making better financial decisions and choose wisely their financial products.,Financial Services,1.0,Juan Camilo González Trujillo,1,Seed,22/01/2020,10000,USD,10000,Pre-Seed,10000.0,USD,10000.0,Pre-Seed,10000.0,USD,10000.0,10000,USD,10000,Juan Camilo González Trujillo,1.0,1.0,0.0,"103,820",52.0,0.0,Colombia,Bogotá,Distrito Especial,0,0.0,0.0,1000.0,2000.0,1.0,1.0,1.0,1.0,1.0,1.0,1.0,1.0
160,Franquicias LATAM,https://www.crunchbase.com/organization/franquicias-latam,Lead Generation,"Bogotá, Distrito Especial, Colombia",Lead Generation for Businesses and Franchises,"99,834",Latin America,Active,01/01/2014,year,0.0,"Franquicias LATAM is a smart and fun lead generation hub for businesses and franchises in Latin America, Europe, and the US.",Sales and Marketing,1.0,Daniel Seneor,1,Seed,08/08/2015,250000,USD,250000,Seed,250000.0,USD,250000.0,Seed,250000.0,USD,250000.0,250000,USD,250000,Inter American Development Bank,1.0,1.0,0.0,"104,191",25.0,0.0,Colombia,Bogotá,Distrito Especial,0,0.0,0.0,2000.0,5000.0,1.0,1.0,1.0,0.0,1.0,1.0,1.0,1.0
161,Nibi,https://www.crunchbase.com/organization/nibi,"Social Entrepreneurship, Software","Bogotá, Distrito Especial, Colombia",Connecting people and companies with impact actions building sustainable habits in LATAM,"100,448",Latin America,Active,06/12/2018,day,0.0,We are connecting people and companies with impact actions building sustainable habits.,"Community and Lifestyle, Software",1.0,Juan Ignacio Rubio,2,Seed,09/09/2019,25000,USD,25000,Pre-Seed,25000.0,USD,25000.0,Pre-Seed,35000.0,USD,35000.0,35000,USD,35000,COLABORATIVOx,1.0,1.0,0.0,"104,847",39.0,0.0,Colombia,Bogotá,Distrito Especial,0,0.0,0.0,1000.0,2000.0,1.0,1.0,1.0,0.0,1.0,1.0,1.0,1.0
162,TrendyTrade,https://www.crunchbase.com/organization/trendytrade,"Data Mining, Financial Services, FinTech","Bogotá, Distrito Especial, Colombia",Financial market data meets crowd sourced sentiment analysis. Find the trendiest trades and smart insights to smarten up your investment.,"100,720",Latin America,Active,01/01/2015,year,4.0,Financial market data meets crowd sourced sentiment analysis. Find the trendiest trades and smart insights to smarten up your investment.,"Data and Analytics, Financial Services, Information Technology",2.0,"Esteban Peñaloza, Jorge Serrano",1,Seed,10/09/2015,260000,USD,260000,Seed,260000.0,USD,260000.0,Seed,260000.0,USD,260000.0,260000,USD,260000,,0.0,0.0,1.0,"105,146",8.0,0.0,Colombia,Bogotá,Distrito Especial,0,0.0,0.0,1000.0,2000.0,1.0,1.0,1.0,1.0,1.0,1.0,1.0,0.0
163,Protraffic,https://www.crunchbase.com/organization/protraffic,"Blockchain, Intelligent Systems, Internet of Things, Transportation","Bogotá, Distrito Especial, Colombia",Protraffic is the second largest company in the Colombian road safety industry.,"101,673",Latin America,Active,01/01/2012,year,7.0,Protraffic is the second largest company in the Colombian road safety industry. Our integral solutions that include state of the art technologies and common road safety products increase the protection of the weakest in the Colombian roads. Right now and conjointly with Andes University we are developing a game-changing industry product known as Helmy.,"Artificial Intelligence, Data and Analytics, Internet Services, Other, Science and Engineering, Transportation",1.0,Mario Varon,2,Seed,01/12/2018,300000,USD,300000,Seed,300000.0,USD,300000.0,Seed,450000.0,USD,450000.0,450000,USD,450000,Mario Varon,0.0,1.0,0.0,"106,166",17.0,0.0,Colombia,Bogotá,Distrito Especial,0,0.0,0.0,2000.0,5000.0,1.0,1.0,1.0,1.0,0.0,1.0,1.0,1.0
164,INplaza,https://www.crunchbase.com/organization/in-plaza,"Artificial Intelligence, B2B, Blockchain, Cryptocurrency, E-Commerce Platforms, Logistics, Machine Learning, Trading Platform","Medellín, Antioquia, Colombia",INplaza is a blockchain technology company that focuses on international trade.,"102,405",Latin America,Active,07/09/2016,day,1.0,"INplaza is a futuristic and an innovative company, maximized by ambitious and competent talent to fulfill our ultimate goal: To give opportunities to the world. We work on a state-of-the-art platform that will revolutionize the international trade. We perform intensive research in machine learning, the blockchain, and other technological innovations. Over the next years, we will equip many of the world’s small and medium enterprises (SMEs) with high-performance technology solutions for a safer, less expensive and faster way to conduct their daily operations.","Artificial Intelligence, Commerce and Shopping, Data and Analytics, Financial Services, Internet Services, Lending and Investments, Other, Payments, Science and Engineering, Software, Transportation",2.0,"Jay Daron, Nathan Brooks",1,Seed,31/03/2017,288000,USD,288000,Seed,288000.0,USD,288000.0,Seed,288000.0,USD,288000.0,288000,USD,288000,,0.0,0.0,0.0,"106,941",8.0,13.0,Colombia,Medellín,Antioquia,0,0.0,0.0,2000.0,5000.0,1.0,1.0,1.0,1.0,1.0,1.0,1.0,0.0
165,DATELLIGENCE,https://www.crunchbase.com/organization/datelligence,"Cloud Data Services, Data Mining, Data Visualization, Enterprise Applications","Bogotá, Distrito Especial, Colombia",Data Visualization over legacy SQL and NoSQL Databases. Data Science as a Service.,"102,664",Latin America,Active,10/01/2005,day,5.0,We use data to leverage corporate decisions.  From data instrumentation to data science we help brick and mortar companies to evolve to digital omnichannel destinations.,"Apps, Data and Analytics, Design, Information Technology, Internet Services, Software",2.0,"Jorge Eduardo Ardila, Sonia Ardila",2,Seed,19/10/2016,325000,USD,325000,Seed,325000.0,USD,325000.0,Seed,650000.0,USD,650000.0,650000,USD,650000,,0.0,0.0,0.0,"107,224",15.0,4.0,Colombia,Bogotá,Distrito Especial,0,1000000.0,10000000.0,1000.0,2000.0,1.0,1.0,1.0,1.0,0.0,1.0,1.0,1.0
166,KADU Collect,https://www.crunchbase.com/organization/kadu-collect,"E-Commerce, Payments, Transaction Processing","Medellín, Antioquia, Colombia",KADU enables 560 million Latin Americans to pay by cash in global ecommerce. Credit Cards only enable 40 million.,"104,898",Latin America,Active,13/07/2013,day,0.0,"KADU was born in November 2013 and its Beta version was launched in November 2014. The KADU group counts with companies in Costa Rica, Colombia, Mexico, Chile and Brazil, and partners around the world to support the most convenient payment methods. KADU’s technology integrates CASH payment methods in the most representative Latin American countries for e-commerce. Please find all payment methods available here. - Use KADU checkout tools to request a payment or integrate them to your website. - Inform all your customers of your new payment methods to increase your sales.","Commerce and Shopping, Financial Services, Payments, Software",1.0,Juan Pablo Bernal Monsalve,3,Seed,01/07/2014,280000,USD,280000,Seed,280000.0,USD,280000.0,Seed,500000.0,USD,500000.0,500000,USD,500000,Juan Pablo Bernal Monsalve,0.0,1.0,0.0,"109,603",8.0,0.0,Colombia,Medellín,Antioquia,0,1000000.0,10000000.0,2000.0,5000.0,1.0,1.0,1.0,1.0,1.0,0.0,0.0,0.0
167,Tuseguro.com,https://www.crunchbase.com/organization/tuseguro-com,Financial Services,"Bogotá, Distrito Especial, Colombia","An online insurance broker operating in Latin America, providing innovative, complete, high quality brokerage services.","106,498",Latin America,Active,01/01/2013,year,0.0,,Financial Services,3.0,"Felipe Lemmo, Kay Boeticher, Roberto Singler",1,Seed,01/01/2017,1000000,USD,1000000,Seed,1000000.0,USD,1000000.0,Seed,1000000.0,USD,1000000.0,1000000,USD,1000000,,0.0,0.0,0.0,"111,319",19.0,4.0,Colombia,Bogotá,Distrito Especial,0,0.0,0.0,1000.0,2000.0,1.0,1.0,1.0,1.0,0.0,0.0,1.0,1.0
168,EFY EASY FOR YOU,https://www.crunchbase.com/organization/efy-easy-for-you,"Beauty, Personal Health, Wellness","Bogotá, Distrito Especial, Colombia",App de servicios de belleza a domicilio que conecta profesionales de belleza con clientes que necesitan sus servicios donde y cuando deseen.,"108,875",Latin America,Active,15/01/2018,day,0.0,"Easy For You connects potential premium beauty clients with professional beauty freelancers, changing the traditional way of making appointments with large anticipation time and having to move to the salon to receive a quality beauty service. Our goal is to improve the conditions of this type of services for both our clients and our beauty professionals. For our clients, we offer premium beauty services such as nails, waxing, makeup, hairstyles, eyelashes and massages in the comfort of their home, office or hotel, without waiting times, lines or traffic and with the possibility to schedule without anticipation. For our professionals, 60% mothers head of the family, we provide a better quality of life so that they can manage their own time without meeting beauty salon schedules with sessions of up to 12 hours with large idle intervals while improving their income from 2 to 5 times.","Consumer Goods, Health Care",1.0,Laura Serrano,1,Seed,15/01/2018,50000,USD,50000,Angel,50000.0,USD,50000.0,Angel,50000.0,USD,50000.0,50000,USD,50000,"Berry Seven, Serrano Ventures",1.0,2.0,0.0,"113,868",51.0,16.0,Colombia,Bogotá,Distrito Especial,0,0.0,0.0,1000.0,2000.0,1.0,1.0,1.0,0.0,1.0,1.0,1.0,1.0
169,Dash,https://www.crunchbase.com/organization/dash-6,"Computer Vision, E-Learning, Education, Online Portals, Video","Bogotá, Distrito Especial, Colombia","Service designed to effectively train your field staff. The online service includes videos, learning evaluations and student tracking.","111,307",Latin America,Active,01/07/2014,day,1.0,"Dash is an e-learning platform designed to effectively train field staff. The online service includes videos, learning evaluations, and student tracking.","Education, Hardware, Internet Services, Media and Entertainment, Software, Video",1.0,Juan Saravia,1,Seed,01/07/2016,64000,USD,64000,Seed,64000.0,USD,64000.0,Seed,64000.0,USD,64000.0,64000,USD,64000,MILL,0.0,1.0,0.0,"116,487",29.0,0.0,Colombia,Bogotá,Distrito Especial,0,0.0,0.0,2000.0,5000.0,1.0,1.0,1.0,1.0,1.0,0.0,1.0,0.0
170,MOONBLOCK,https://www.crunchbase.com/organization/moonblock,"Artificial Intelligence, Blockchain, Cryptocurrency, Financial Services, FinTech, Information Technology, Machine Learning, Software","Medellín, Antioquia, Colombia","MOONBLOCK develops all the professional tools you need to trade in the CRYPTO market, in one single platform.","111,437",Latin America,Active,01/01/2018,year,0.0,"MOONBLOCK develops disruptive tools powered by artificial intelligence. Our trained algorithms can enter the Crypto ecosystem and dig deeper into the technical and fundamental data to cast the most suitable actions within the Crypto market in real-time.  We display organized, truthful and relevant Data to assess the market in a fully informed and emotionless way to make SMART trading decisions.","Artificial Intelligence, Data and Analytics, Financial Services, Information Technology, Other, Payments, Science and Engineering, Software",1.0,Sebastian Figueroa,1,Seed,15/03/2018,150000,USD,150000,Pre-Seed,150000.0,USD,150000.0,Pre-Seed,150000.0,USD,150000.0,150000,USD,150000,,0.0,0.0,0.0,"116,628",1.0,0.0,Colombia,Medellín,Antioquia,0,0.0,0.0,1000.0,2000.0,1.0,1.0,1.0,1.0,1.0,1.0,1.0,1.0
171,dondoctor,https://www.crunchbase.com/organization/dondoctor,"Health Care, Software","Bogotá, Distrito Especial, Colombia",Dondoctor is an online scheduling and telemedicine for clinics and hospitals.,"112,555",Latin America,Active,01/01/2014,year,0.0,"dondoctor provides an online scheduling software for medical centers, clinics and hospitals","Health Care, Software",1.0,Felipe Acosta,1,Seed,01/07/2020,800000,USD,800000,Seed,800000.0,USD,800000.0,Seed,800000.0,USD,800000.0,800000,USD,800000,,0.0,0.0,0.0,"117,806",0.0,0.0,Colombia,Bogotá,Distrito Especial,0,0.0,0.0,2000.0,5000.0,1.0,1.0,1.0,0.0,0.0,1.0,1.0,1.0
172,Bluma,https://www.crunchbase.com/organization/bluma,"Beauty, Wellness","Medellín, Antioquia, Colombia",Bluma is a technology platform that allows beauty-conscious contemporary women to save time by having their on-demand beauty needs.,"115,144",Latin America,Active,01/06/2018,day,0.0,"Bluma is a technology platform that allows beauty-conscious contemporary women to save time by having their on-demand beauty needs fulfilled by a lifestyle brand in the comfort of their home. Independent service providers, qualified by Bluma and operating under the Bluma brand deliver the services following Bluma Standard Guidelines. Bluma is headquartered in Medellín, Colombia","Consumer Goods, Health Care",0.0,,1,Seed,01/08/2018,70000,USD,70000,Angel,70000.0,USD,70000.0,Angel,70000.0,USD,70000.0,70000,USD,70000,,0.0,0.0,0.0,"120,582",31.0,0.0,Colombia,Medellín,Antioquia,0,0.0,1000000.0,1000.0,2000.0,1.0,1.0,1.0,0.0,1.0,0.0,1.0,0.0
173,Cositas de España,https://www.crunchbase.com/organization/cositas-de-españa,E-Commerce,"Madrid, Distrito Especial, Colombia",Cositas de España is an e-commerce dedicated to sell clothes from European firms in the Latin American market.,"117,499",Latin America,Active,04/11/2015,day,0.0,"Cositas de España (CdE) is an e-commerce dedicated to sell clothes from European firms in the Latin American market, where they barely have presence. The CEO and founder of the company, which has Peruvian nationality, realized that all her relatives observed her clothes everytime she came back to Peru from Spain, asking her to bring garments to them when she came back. ​ Dicovering the opportunity, she carried out a pilot test, in order to see whether this was a real need of South American women. The test’s sales amounted to 16,000€ in just 6 months, what confirmed that, effectively, this was a real need to satisfy. The spectacular results of this test were what finally made her found CdE.",Commerce and Shopping,0.0,,1,,17/05/2017,108299,EUR,120807,Equity Crowdfunding,108299.0,EUR,120807.0,Equity Crowdfunding,108299.0,EUR,120807.0,108299,EUR,120807,Fellow Funders,0.0,1.0,0.0,"123,121",5.0,0.0,Colombia,Madrid,Distrito Especial,0,0.0,0.0,2000.0,5000.0,1.0,1.0,1.0,0.0,1.0,0.0,0.0,0.0
174,MENTe Labs,https://www.crunchbase.com/organization/mente-labs,"Analytics, Artificial Intelligence, Big Data, Business Intelligence, Machine Learning","Bogotá, Distrito Especial, Colombia",Company specializing in human behavior analysis using algorithms and artificial intelligence to profile people.,"118,191",Latin America,Active,01/01/2017,year,0.0,"MENTe is a system capable of taking all public information available from a person, including social network publications and building a behavior profile using artificial intelligence algorithms, data analysis and Big Data. MENTe interpreted every word, every photo, every video of Like you and published, understanding what they think, what they feel and what people do. Using MENTe you can identify the trends of your employees, the tastes of your students; What your children comment and the key issues to interact with your customers.","Artificial Intelligence, Data and Analytics, Science and Engineering, Software",1.0,Mauricio Arevalo Buitrago,1,Seed,01/10/2017,170000,USD,170000,Seed,170000.0,USD,170000.0,Seed,170000.0,USD,170000.0,170000,USD,170000,Wavecomm Corp,0.0,1.0,0.0,"123,858",23.0,0.0,Colombia,Bogotá,Distrito Especial,0,0.0,0.0,1000.0,2000.0,1.0,1.0,1.0,1.0,1.0,1.0,1.0,1.0
175,Vennta.com,https://www.crunchbase.com/organization/vennta-com,"Advertising, Commercial Real Estate, Real Estate, Real Estate Investment","Bogotá, Distrito Especial, Colombia","We are accelerating the real estate sales of new and used properties in Bogotá, Medellín and Cartagena.","119,972",Latin America,Active,01/10/2019,day,0.0,"We are accelerating the real estate sales of new and used properties in Bogotá, Colombia; using marketing and client service without bots with a concierge system.","Advertising, Financial Services, Real Estate, Sales and Marketing",1.0,Sebastián Morales Anaya,1,Seed,04/10/2019,10000,USD,10000,Pre-Seed,10000.0,USD,10000.0,Pre-Seed,10000.0,USD,10000.0,10000,USD,10000,Berry Seven,1.0,1.0,0.0,"125,770",29.0,0.0,Colombia,Bogotá,Distrito Especial,0,0.0,0.0,1000.0,2000.0,1.0,1.0,1.0,0.0,1.0,1.0,1.0,1.0
176,Protesis Avanzadas SAS,https://www.crunchbase.com/organization/tech-bionic-hand-by-protesis-avanzadas,"3D Technology, Hospital, Medical, Medical Device","Medellín, Antioquia, Colombia","Prótesis Avanzadas SAS is a company dedicated to de design, manufacture and merchandise of robotic prosthetic arm..","120,500",Latin America,Active,15/07/2015,day,0.0,"Company dedicated to design, manufacture and sell of robotic prosthetic arm. We have two diferent products, one is the robotic aktio a3d, a full 3D printed prosthetic arm, with programable functions. Other is a baseic robotic full 3d printed arm with cosmetic glove, with a special similarity to human hand and arm.","Hardware, Health Care, Software",0.0,,2,Seed,24/08/2019,230000,USD,230000,Non-equity Assistance,20000.0,USD,20000.0,Pre-Seed,20000.0,USD,20000.0,250000,USD,250000,,0.0,0.0,0.0,"126,330",21.0,0.0,Colombia,Medellín,Antioquia,0,1000000.0,10000000.0,1000.0,2000.0,1.0,1.0,1.0,1.0,1.0,1.0,1.0,1.0
